### ISSUE TITLE
Excel + ODBC

### ISSUE THREAD

**Issue by sunsingerus** [yandex/clickhouse-odbc#31]
Trying to connect to ClickHouse from Excel.
ODBC driver - just built from master branch 32-bit source.
Connection string:
```
DSN=CH ANSI;DATABASE=default;SERVER=192.168.74.166;PORT=8123;UID=default;
```
As a result see the following error:
![excel_error](https://user-images.githubusercontent.com/19861850/29782418-3016b898-8c25-11e7-846c-1f8a8bf6d826.png)

For the following Excel configuration
![excel](https://user-images.githubusercontent.com/19861850/29782434-41eb6c26-8c25-11e7-8057-d5fec3c7ff32.png)

tcpdump on CLickHouse's side on port 8123 caught data exchange
```
user@ubuntu:~$ sudo tcpdump port 8123 -vv -s 512
tcpdump: listening on ens33, link-type EN10MB (Ethernet), capture size 512 bytes
09:08:23.950916 IP (tos 0x0, ttl 128, id 2201, offset 0, flags [DF], proto TCP (6), length 52)
    192.168.74.177.1198 > 192.168.74.166.8123: Flags [S], cksum 0xc7e5 (correct), seq 2686430201, win 8192, options [mss 1460,nop,wscale 8,nop,nop,sackOK], length 0
09:08:23.950962 IP (tos 0x0, ttl 64, id 7015, offset 0, flags [DF], proto TCP (6), length 40)
    192.168.74.166.8123 > 192.168.74.177.1198: Flags [R.], cksum 0x28a5 (correct), seq 0, ack 2686430202, win 0, length 0
09:08:24.468841 IP (tos 0x0, ttl 128, id 2202, offset 0, flags [DF], proto TCP (6), length 52)
    192.168.74.177.1198 > 192.168.74.166.8123: Flags [S], cksum 0xc7e5 (correct), seq 2686430201, win 8192, options [mss 1460,nop,wscale 8,nop,nop,sackOK], length 0
09:08:24.468913 IP (tos 0x0, ttl 64, id 7022, offset 0, flags [DF], proto TCP (6), length 40)
    192.168.74.166.8123 > 192.168.74.177.1198: Flags [R.], cksum 0x28a5 (correct), seq 0, ack 1, win 0, length 0
```
So, ClickHouse is accessible for Excel

Please, advise!

**Comment by artpaul** [comment]
Hi,
can you provide sequence of the menu items which leads you to this result?
And also please provide version of Excel.

**Comment by artpaul** [comment]
And as an advice, it better to collect ODBC trace rather than tcpdumps. It provides more specific information about what ODBC driver is doing.

Please read this article about how to collect the trace:  
http://www-01.ibm.com/support/docview.wss?uid=swg21384531

**Comment by sunsingerus** [comment]
>can you provide sequence of the menu items which leads you to this result?
>And also please provide version of Excel.

Yes, sure. Excel 2016. As to sequence of items - it is like the following:
![excel_list](https://user-images.githubusercontent.com/19861850/29813027-55c3228e-8cb1-11e7-8aa4-e8fbe93b8889.png)

As to erroneous situation - now observing Excel crash when selecting ClickHouse Unicode Driver. 

When selecting ClickHouse ANSI driver - looks like something changed on my side - the only incorrect behavior now is unreadable non-latin chars in output:
![excel_chars](https://user-images.githubusercontent.com/19861850/29813173-e23f7a8c-8cb1-11e7-8db9-b8f3e6b91fc0.png)

Can you suggest anything on how to treat non-latin chars propoerly?

**Comment by sunsingerus** [comment]
>Please read this article about how to collect the trace:
>http://www-01.ibm.com/support/docview.wss?uid=swg21384531

Yes, thanks for advice!

**Comment by artpaul** [comment]
I have reproduced problem with non-latin chars. So I think what the error somewhere in the driver.

**Comment by artpaul** [comment]
I found what the problem with non-latin chars exists only in Windows. In Linux all works fine.

**Comment by artpaul** [comment]
I have fixed Excel's crash with Unicode driver. 
Also in Windows if you want work with non-latin chars you should use Unicode driver.
