### ISSUE TITLE
ODBC и VM

### ISSUE THREAD

**Issue by imbelousov** [yandex/clickhouse-odbc#155]
Наблюдаю странное поведение ODBC-драйвера в следующей конфигурации.
Локально под виртуальной машиной развёрнут инстанс ClickHouse под Debian, на хост Windows с него проброшены порты 8123 и 9000, на винде стоит ODBC-драйвер.
Через JDBC всё хорошо, через нативный протокол тоже всё хорошо, если открыть в браузере http://localhost:8123/, получаю ответ "Ok.". Пытаюсь подключиться через ODBC - получаю ошибку 'Connection refused: '.
Проверял с помощью Excel и .NET OdbcConnection.
Строка подключения: "Driver=ClickHouse Unicode;Database=default;Server=localhost;Port=8123;UId=default;"
Причём если развернуть ClickHouse на физической машине и попытаться подключиться, то всё в порядке, то есть проблема только при попытке подключиться к виртуальной машине.
Не подскажете, в чём может быть проблема? Может быть, требуется пробросить ещё какой-то порт помимо 8123?

**Comment by Slach** [comment]
Думаю имеет смысл поставить wireshark и снять дамп трафика с 8123 порта на windows хосте

firewall точно не мешает?
wf.msc запустите посмотрите что для Excel запрещено\разрешено...

**Comment by proller** [comment]
Помимо порта 8123 другие не нужны.
А в логах ClickHouse есть что-нибудь в момент подключения?
Можно еще влючить лог драйвера clickhouse-odbc - в 
Database=default;Server=localhost;Port=8123;UId=default;
добавить Trace=1 - лог создастся в /temp/clickhouse-odbc.log (если temp существует)
Или дополнительно указать TraceFile=/path/file.log
В логе будут записи про соединение на url , точно ли он там http://localhost:8123/ ?

**Comment by imbelousov** [comment]
Firewall был отключен, к тому же это не объясняет, почему коннект с JDBC или напрямую по HTTP шёл. На виртуальную машину вообще не шло подключение, мониторил через tcpdump.
Удалось подключиться после изменения типа адаптера в VirtualBox с NAT на Virtual Host Adapter и пробрасывания портов вручную.

**Comment by IvanTheFirst** [comment]
Та же проблема. Порты проброшены, так же virtualbox. Clickhouse просто сбрасывает соединение. 
Вот пакет с influx на той же виртуалке - 

> 14:58:16.731260 IP _gateway.51646 > local-monitoring.8086: Flags [S], seq 1568256001, win 65535, options [mss 1460], length 0
> 14:58:16.731367 IP local-monitoring.8086 > _gateway.51646: Flags [S.], seq 3839027193, ack 1568256002, win 64240, options [mss 1460], length 0
> 14:58:16.731735 IP _gateway.51646 > local-monitoring.8086: Flags [.], ack 1, win 65535, length 0
> 14:58:16.745884 IP _gateway.51646 > local-monitoring.8086: Flags [P.], seq 1:518, ack 1, win 65535, length 517
> 14:58:16.745984 IP local-monitoring.8086 > _gateway.51646: Flags [.], ack 518, win 63784, length 0
> 14:58:16.750882 IP local-monitoring.8086 > _gateway.51646: Flags [P.], seq 1:1998, ack 518, win 63784, length 1997
> 14:58:16.751035 IP _gateway.51646 > local-monitoring.8086: Flags [.], ack 1461, win 65535, length 0
> 14:58:16.751043 IP _gateway.51646 > local-monitoring.8086: Flags [.], ack 1998, win 65535, length 0
> 14:58:16.751740 IP _gateway.51646 > local-monitoring.8086: Flags [P.], seq 518:598, ack 1998, win 65535, length 80
> 14:58:16.751752 IP _gateway.51646 > local-monitoring.8086: Flags [P.], seq 598:773, ack 1998, win 65535, length 175
> 14:58:16.751965 IP local-monitoring.8086 > _gateway.51646: Flags [.], ack 773, win 63784, length 0
> 14:58:16.752402 IP local-monitoring.8086 > _gateway.51646: Flags [P.], seq 1998:2288, ack 773, win 63784, length 290
> 14:58:16.752466 IP _gateway.51646 > local-monitoring.8086: Flags [.], ack 2288, win 65535, length 0
> 14:58:16.753537 IP local-monitoring.8086 > _gateway.51646: Flags [P.], seq 2288:2445, ack 773, win 63784, length 157
> 14:58:16.753617 IP _gateway.51646 > local-monitoring.8086: Flags [.], ack 2445, win 65535, length 0
> 14:58:16.753791 IP _gateway.51646 > local-monitoring.8086: Flags [P.], seq 773:797, ack 2445, win 65535, length 24
> 14:58:16.754076 IP local-monitoring.8086 > _gateway.51646: Flags [P.], seq 2445:2469, ack 797, win 63784, length 24
> 14:58:16.754150 IP _gateway.51646 > local-monitoring.8086: Flags [.], ack 2469, win 65535, length 0
> 14:58:16.754376 IP local-monitoring.8086 > _gateway.51646: Flags [F.], seq 2469, ack 797, win 63784, length 0
> 14:58:16.754440 IP _gateway.51646 > local-monitoring.8086: Flags [R.], seq 797, ack 2469, win 65535, length 0
> 14:58:16.754444 IP _gateway.51646 > local-monitoring.8086: Flags [R], seq 1568256798, win 0, length 0
> 14:58:38.847145 IP _gateway.45016 > local-monitoring.8123: Flags [S], seq 1571072001, win 65535, options [mss 1460], length 

0
14:58:38.847202 IP local-monitoring.8123 > _gateway.45016: Flags [R.], seq 0, ack 1571072002, win 0, length 0


а вот пакеты от clickhouse

> 14:58:55.065281 IP _gateway.45054 > local-monitoring.8123: Flags [S], seq 1573056001, win 65535, options [mss 1460], length 0
> 14:58:55.065368 IP local-monitoring.8123 > _gateway.45054: Flags [R.], seq 0, ack 1573056002, win 0, length 0


а это пакеты с самого хоста, где виртуалка работает:

> 14:58:55.154386 IP localhost.45054 > localhost.8123: Flags [S], seq 2966258224, win 65495, options [mss 65495,sackOK,TS val 2794459372 ecr 0,nop,wscale 7], length 0
> 14:58:55.154411 IP localhost.8123 > localhost.45054: Flags [S.], seq 1807210115, ack 2966258225, win 65483, options [mss 65495,sackOK,TS val 2794459372 ecr 2794459372,nop,wscale 1], length 0
> 14:58:55.154437 IP localhost.45054 > localhost.8123: Flags [.], ack 1, win 512, options [nop,nop,TS val 2794459372 ecr 2794459372], length 0
> 14:58:55.154535 IP localhost.45054 > localhost.8123: Flags [P.], seq 1:83, ack 1, win 512, options [nop,nop,TS val 2794459372 ecr 2794459372], length 82
> 14:58:55.154547 IP localhost.8123 > localhost.45054: Flags [.], ack 83, win 32701, options [nop,nop,TS val 2794459372 ecr 2794459372], length 0
> 14:58:55.155484 IP localhost.8123 > localhost.45054: Flags [R.], seq 1, ack 83, win 32742, options [nop,nop,TS val 2794459373 ecr 2794459372], length 0

**Comment by IvanTheFirst** [comment]
Сам спросил, сам разобрался. По умолчанию clickhouse слушает всё на 127.0.0.1, надо перевести на все интерфейсы, например настройкой - 
cat /etc/clickhouse-server/config.d/listen-host.xml 
<yandex>
	<listen_host>::</listen_host>
</yandex>
и будет всё в порядке.
